Nama,Rating,Location,Open,Close,Foto
Pasar Tradisional Kartika Udayana,4.6,"Kuta, Kec. Kuta, Kabupaten Badung, Bali 80361",04.00,20.00,https://lh5.googleusercontent.com/p/AF1QipN3Nnk_NsgTPzyXJ6XL-lHS4a63i7uxBpjOg9AX=w122-h92-k-no
Pasar Kreneng,4.4,"Dangin Puri Kangin, Kec. Denpasar Utara, Kota Denpasar, Bali 80236",04.00,15.00,https://lh5.googleusercontent.com/p/AF1QipNv-5-VLe61jHMXBsA22X-y3h9mRe6GbnYtleuD=w122-h92-k-no
Pasar Anyar Gelogor carik,4.6,"Jl. Glogor Carik No.27, Pemogan, Denpasar Selatan, Kota Denpasar, Bali 80221",02.00,23.00,https://lh5.googleusercontent.com/p/AF1QipMfyvrIycW5M1klU0GLP7yv5PnvSg0t3CB0siLk=w163-h92-k-no
Pasar Badung Kota Denpasar - Smart Heritage Market,4.5," Jalan Gajah Mada, Pemecutan, Dauh Puri Kangin, Denpasar City",02.00,23.00,https://lh5.googleusercontent.com/p/AF1QipMSP7TQxOkWIsgmWvFQyQNlb5PkIad76nYDGjms=w122-h92-k-no
Pasar Asoka,4.4,"Jl. Kamboja, Dangin Puri Kangin, Kec. Denpasar Utara, Kota Denpasar, Bali 80236",02.00,23.00,https://lh5.googleusercontent.com/p/AF1QipO3LzdKl-PHCPUcVAYcZLczpINErwQJrskXmwhH=w164-h92-k-no
Pasar Tamansari Grudugan / Pasar Wates Sesetan,4.2,"Jl. Raya Sesetan No.333, Sesetan, Denpasar Selatan, Kota Denpasar, Bali 80223",02.00,23.00,https://lh5.googleusercontent.com/p/AF1QipPj9ND4IBI5kdCp0ye9SzIRZ-jZKRuVDdyNRQNC=w122-h92-k-no
Pasar Pasah Pemecutan,4.4,"Jl. Gn. Batur No.34, Pemecutan, Kec. Denpasar Bar., Kota Denpasar, Bali 80112",05.00,17.00,https://lh5.googleusercontent.com/p/AF1QipMWJJ_WPY-WF1IOoqqer36LBX5NGS68eELvCQY0=w189-h92-k-no
Pasar Tradisional Galang Ayu,4.5,"Jl. Pulau Galang No.9, Pemogan, Denpasar Selatan, Kota Denpasar, Bali 80113",08.00,22.00,https://lh5.googleusercontent.com/p/AF1QipN1gg2oo6FaI4lhjtjQlJiUqnGQgqqdF-ifHkxx=w122-h92-k-no
Panjer Traditional Market,4.5,"Jl. Tukad Pakerisan No.6, Panjer, Denpasar Selatan, Kota Denpasar, Bali 80234",06.00,20.30,https://lh5.googleusercontent.com/p/AF1QipOXy9c13pe9ttFum_oaoL5Y0POQjH-uSusRsSBh=w80-h106-k-no
Pasar Desa Tegal Harum,4.4,"Jl. Gunung Rinjani No.99X, Tegal Harum, Kec. Denpasar Bar., Kota Denpasar, Bali 80112",06.00,16.30,https://lh5.googleusercontent.com/p/AF1QipOSVTJXYOMd9XjXxYX84JZ3WAiSumKc-YmDZvUX=w408-h306-k-no
Pasar Agung Peninjoan,4.4,"Jl. Cekomaria No.1, Peguyangan Kangin, Kec. Denpasar Utara, Kota Denpasar, Bali 80238",02.00,23.00,https://lh5.googleusercontent.com/p/AF1QipOdmnIbHHcxlxQ1tzxcNLk5GkyCMNSIxu1KZpnQ=w426-h240-k-no
Pasar tradisional pasar sumuh,4.4,"Jl. Pulau Misol No.35, Dauh Puri Kauh, Kec. Denpasar Bar., Kota Denpasar, Bali 80113",05.00,21.00,https://lh5.googleusercontent.com/p/AF1QipOgj65k_KYDF0W5MVeUVsNqmT4ZjC9NTiXeEKRK=w122-h92-k-no
PASAR TRADISIONAL ALAS KUSUMA,4.4,"Jl. Raya Uluwatu No.88, Jimbaran, Kec. Kuta Sel., Kabupaten Badung, Bali 80361",04.00,22.00,https://lh5.googleusercontent.com/p/AF1QipNfWA53CzIa2aM71fUcp_nXwXPvg0cIZDZODOnb=w80-h142-k-no
