Nama,Rating,Location,Open,Close
Rama Krisna Oleh Oleh Bali 24 Jam,4.5,"Jl. Raya Tuban No.2X, Tuban,Kabupaten Badung",06.00,23.00
Oleh Oleh Khas Bali,4.3,Jl. Veteran No.59,08.00,21.00
Krisna Oleh oleh Khas Bali,4.4,"Jl. Seririt- Singaraja, Temukus,Kabupaten Buleleng,",08.00,22.00
Krisna Oleh  Oleh Bali Sunset Road,4.4,"Jl. Sunset Road No.88, Kuta,Kabupaten Badung",08.00,22.00
Prema Rasa Oleh Oleh Khas Bali,5.0,"Jl. Raya Kuta No.85, Tuban,Kabupaten Badung",08.00,23.00
Krisna Oleh Oleh khas Bali Nusa Kambangan,4.4,"Jl. Nusa Kambangan No.160 A, Dauh Puri KauhKota Denpasar",08.00,22.00
Krisna Oleh-oleh Khas Bali Nusa Indah,4.4,Jl. Nusa Indah No.77,08.30,21.00
The Keranjang Bali - Surga Baru Oleh Oleh Bali,4.6,"Jl. Bypass Ngurah Rai No.97, Kuta, Kabupaten Badung",09.00,21.00
KRISNA Oleh-Oleh Khas Bali - Samasta Jimbaran,4.4,"Jl. Wanagiri, Jimbaran, Kabupaten Badung",10.00,22.00
Larisa Oleh-oleh Bali,4.4,"Jl. Raya Kuta No.45 B, Kuta,Kabupaten Badung",09.00,22.00
BELANJA Oleh Oleh Bali,3.8,"Jl. Tukad Yeh Aya No.175a, Renon,Kota Denpasar",09.00,18.00
Agung Bali Oleh-Oleh Sunset Road,4.4,"Jl. Sunset Road No.18,Kuta,Kabupaten Badung",08.00,22.00
Agung Bali Oleh - oleh Dewi Sri,4.4,"Jl. Dewi Sri No.18XX, LegianKabupaten Badung",08.00,22.00
Toko Oleh Oleh Khas Bali Mbak Tutik,4.5,"Jl. Sumatera No.29, Dauh Puri KanginKota Denpasar",08.00,21.00
Oleh - Oleh Khas Bali,5.0,"Jl. Gunung Salak No.216, Tegallalang,Kota Denpasar",07.30,20.00
Bali Jaen (Oleh-oleh khas Bali),5.0,"Jl. Glogor Carik, Pemogan,Kota Denpasar",08.00,02.00
Surya Bali Oleh-Oleh Khas Bali,5.0,"Jl. Raya Kuta No.61, Kuta,Kabupaten Badung",08.00,23.00
Kampung oleh-oleh Bali Murah,4.9,"Jl. Dewi Sri, Legian,Kabupaten Badung",09.00,22.00
Oleh Oleh Bali,3.8,"Jl. Raya Semer No.2, Kerobokan,Kabupaten Badung",08.00,21.00
"TOKO KALIMANTA OLEHOLEH BALI""",4.0,"Jl. Sunset Road No.5, Kuta,Kota Denpasar",08.00,17.00
Sunset Pusat Oleh - Oleh Bali,5.0,"Jl. Mekarsari - Baturiti Bedugul No.575, Mekarsari,  Kabupaten Tabanan",08.00,20.00
Pie Susu Dhian Toko Bali,5.0,"Gg. J No.11, Panjer, Kota Denpasar",08.00,22.00
Warung Oleh Oleh Putri Bali,5.0,"Jl. Patih Jelantik No.3, Dauh Puri Klod,Kota Denpasar",08.00,22.00
Jepun Bali Oleh-oleh Bali (Souvenier),4.6,"Kuta, Kec. Kuta, Kabupaten Badung",08.00,10.00
Snack Meyuk! Oleh-Oleh Khas Bali,5.0,"Jl. Patih Jelantik No.55, Legian, Kec. Kuta, Kabupaten Badung",09.00,21.30
Erlangga 2,4.6,"Jl. Nusa Kambangan No.162, Dauh Puri Kauh, Kec. Denpasar Bar., Kota Denpasar, Bali 80113",08.30,21.45
Pabrik Kata-Kata Joger,4.5,"Jl. Raya Kuta, Kuta, Kec. Kuta, Kabupaten Badung, Bali 80361",10.00,17.00
Pia Legong,3.9,"Ruko Kuta Megah No. 15, Jalan By Pass Ngurah Rai, Tuban, Kuta, Tuban, Kec. Kuta, Kabupaten Badung, Bali 80361",09.00,17.00
NURUL BAJU BALI,5.0,"Jl. Tukad Badung XIV D No.16, Renon, Denpasar Selatan, Kota Denpasar, Bali 80226",08.00,20.00
Baju Bali At Centro,4.3,"Jl. Kartika Plaza, Kuta, Kec. Kuta, Kabupaten Badung, Bali 80361",10.00,22.00
Baju Bali Murah,4.2,"Perum Padang Gajah Jl. Padang Gajah No.5, Padangsambian, Kec. Denpasar Bar., Kota Denpasar, Bali 80119",10.00,16.00
Bali Baju,4.4,"Jl. Tukad badung timur Kelurahan renon, Dangin Puri Klod, Denpasar Selatan, Kota Denpasar, Bali 80226",08.00,17.00
Baju Bali Oleh- Oleh Bali,4.0,"Gg. Sari Ayu No.2 A, Tonja, Kec. Denpasar Utara, Kota Denpasar, Bali 80236",13.00,17.00
vanda baju bali,5.0,"Gg. Asem VII Blk. A No.3a, Tegal Harum,Kota Denpasar, Bali 80119",08.05,16.00
Baju Bali Murah,5.0,"Jl. Tukad Irawadi Gg. X No.10, Panjer, Denpasar Selatan, Kota Denpasar, Bali 80225",09.00,18.00
Toko Baju Sintia,4.3,"Jl. Wibisana Bar. No.69, Pemecutan Kaja, Kec. Denpasar Utara, Kota Denpasar, Bali 80111",08.30,22.00
Local Fruit And Vegetable Market,4.5,"Jl. Raya Taman No.88, Seminyak, Kec. Kuta, Kabupaten Badung, Bali 80361",09.00,22.30
Pasar Pudak Batu Bulan,4.2," Jl. Pudak, Batubulan, Kec. Sukawati, Kabupaten Gianyar, Bali 80582",02.00,23.00
Pasar Sari Murni,4.5,"Jl. Kebo Iwa Utara No.47, Padangsambian Kaja, Kec. Denpasar Barat,Kota Denpasar, Bali 80117",04.00,21.00
Pasar Desa Pakraman Panjer,4.5,"Jl. Tukad Pakerisan No.55A, Dauh Puri Klod, Denpasar Selatan, Kota Denpasar, Bali 80225",05.30,17.00
Pasar Senggol Sukawati,4.5,"WANTILAN Pura Kahyangan Jagat Penataran Agung, Jl. Raya Sukawati Banjar Mudita No.18x, Sukawati, Gianyar Regency, Bali 80582",16.00,23.30
Pasar Desa Pakraman Padangsambian,4.5,"Jl. Tangkuban perahu III No.16, Padangsambian, Kec. Denpasar Barat,Kota Denpasar, Bali 80118",05.00,11.00
"Pasar Kerta Waringin Anggabaya""",4.4,"Penatih,Kota Denpasar",02.00,23.59
Pasar Anyar Pitik Sari,4.5,"Jl. Kubu Abasan, PedunganKota Denpasar",06.00,21.00
Pasar Sedana Kerthi,4.4,"Jl. Raya Jagapati No.15, Jagapati,Kabupaten Badung",04.30,21.00
Pasar Rakyat Desa Pakraman Pohgading,4.4,"Jl. Tunggul Ametung III, Ubung Kaja,",05.00,12.00
Pasar Umum Sukawati,4.2,"Jl. Raya Sukawati No.75X, Sukawati, Kec. Sukawati, Kabupaten Gianyar, Bali 80582",07.00,18.00
PASAR KARYA MULYA,4.4,"Jl. Mertasari No.68-76, Sidakarya,Kota Denpasar",07.00,23.00
Pasar Bunga Wangaya,4.4,"Jl. Kartini No.100, Dauh Puri Kaja,Kota Denpasar",06.00,20.00
Pasar Ketapian,4.4,"Jl. Pucuk, Sumerta, Kota Denpasar",05.00,20.00
Pasar,4.3,"Jl Pantai Berawa , tibubeneng , Kuta Utara",14.00,23.59
Pasar Tradisional Mahendradata,4.3,"Gg. Kulma, Padangsambian, Kota Denpasar",08.00,18.00
Baju Bali 88,5,"Jl. Subur No.80211, Pemecutan Klod,Kota Denpasar",09.00,20.00
Ayra Shop Bali,5.0,"Gg. Merta Shanti 2 No.16, Pemogan, Denpasar Selatan, Kota Denpasar, Bali 80221",07.00,21.30
Novi Collections (Garment Produsen Baju Bali),4.6,"Jl. Pulau Moyo XV, Pedungan, Denpasar Selatan, Kota Denpasar, Bali 80222",08.00,17.00
BaliCihui,5.0,"Jl. Pulau Moyo XV, Pedungan, Denpasar Selatan, Kota Denpasar, Bali 80222",08.00,17.00
ADEEVA COLLECTION (Grosir Baju Bali),5.0,"Jl. Ahmad Yani Utara No.344, Peguyangan, Kec. Denpasar Utara, Kota Denpasar, Bali 80239",09.00,17.00
Baju Barong Oleh Oleh Khas Bali,3.0,"Jl. Raya Kuta No.45B, Tuban, Kec. Kuta, Kabupaten Badung, Bali 80361",09.00,20.00
Plong Collection Bali,5.0,"Jl. Perum Padang Asri Gg. I No.10, Padangsambian Klod, Kec. Denpasar Bar., Kota Denpasar, Bali 80117",06.30,22.00
Bali Frangipani - Bali Daily Sweet Clothes (Online Shop Baju),5.0,"Gg. Anyar No.6, Pemogan, Denpasar Selatan, Kota Denpasar, Bali 80221",06.00,23.00
Hasika Store (Baju Anak Murah Denpasar Bali),5.0,"Jl. Gunung Gede No.88, Padangsambian, Denpasar Barat, Denpasar City, Bali 80119",10.00,21.00
Bali Citra Busana Collection,4.7,"Jl. Raya Pemogan No.182, Pemogan, Denpasar Selatan, Kota Denpasar, Bali 80221",08.00,22.00
Busana Bali,4.1,"Jl. Kaswari, Gg. Alpukat Perum Kaswari Indah No.6, Penatih, Kec. Denpasar Tim., Kota Denpasar, Bali 80236",08.00,19.30
"Bajubali Murah Kerobokan""",4.8,"Jl. Raya Kerobokan No.6, Kerobokan Kelod, Kec. Kuta Utara, Kabupaten Badung, Bali 80361",02.00,23.00
Toko Baju Dewantara,4.3,"Jl. Ahmad Yani Utara No.170, Peguyangan, Kec. Denpasar Utara, Kota Denpasar, Bali 80115",08.30,22.00
BAJU CENIK Kerobokan,4.6,"Jl. Raya Canggu Jl. Banjar Anyar, Kerobokan, Kec. Kuta Utara, Kabupaten Badung, Bali 80361",09.00,22.00
Modis Store,4.3,"Jl. Tukad Barito Timur No.32, Panjer, Denpasar Selatan, Kota Denpasar, Bali 80225",09.30,21.30
Artika Bali Collection,4.6,"Jl. Pulau Bangka No.7, Pedungan, Denpasar Selatan, Kota Denpasar, Bali 80114",09.00,19.00
Doremi Daster Bali Online,4.8,"Jl. Dewi Sartika, Kuta, Kec. Kuta, Kabupaten Badung, Bali 80361",12.00,20.00
WAFS BALI,4.1,"Jl. Tukad Sari Kuning No.38, Dauh Puri Klod, Kec. Denpasar Bar., Kota Denpasar, Bali 80225",02.00,23.00
Mega Bali,5.0,"Jl. Gn. Mas No.8a, Padangsambian Klod, Kec. Denpasar Bar., Kota Denpasar, Bali 80117",08.00,22.00
Simple Store Bali,4.5,"Jl. Pulau Misol No.20 a, Dauh Puri Kauh, Kec. Denpasar Bar., Kota Denpasar, Bali 80113",13.00,23.00
Yans Collection Bali,5.0,"Gg. Taman Sari I No.23E, Sesetan, Denpasar Selatan, Kota Denpasar, Bali 80225",09.00,17.00
balilais.co,4.8,"Jl. Raya Padang Luwih No.147a, Tegal Jaya, Dalung, Kec. Kuta Utara, Kabupaten Badung, Bali 80361",08.00,21.00
Bali Store Men,5.0,"Jl. Gunung Rinjani No.60, Tegal Kertha, Kec. Denpasar Bar., Kota Denpasar, Bali 80112",09.00,21.00
Surf Clothing Bali,5.0,"Jl. Raya Buduk Br. Bernasi, Buduk, Kec. Mengwi, Kabupaten Badung, Bali 80351",09.00,21.00
balishariya&co.,4.8,"Komplek Burung, Jl. Cendrawasih No.7, Tuban, Kec. Kuta, Kabupaten Badung, Bali 80361",08.00,18.00
Ricknandy Bali Style,5.0,"Batubulan, Kec. Sukawati, Kabupaten Gianyar, Bali 80237",08.00,17.00
DIKA UDENG BALI - DENPASAR,4.6,"Jl. Nusa Indah No.44, Sumerta, Kec. Denpasar Tim., Kota Denpasar, Bali 80236",09.00,21.00
Tropical Fashion,4.9,"Jl. Pulau Adi VI No.23, Pedungan, Kota Denpasar",09.00,21.00
Baju Cenik cabang abianbase,5.0,"Jl. Raya Abianbase No.102, Abianbase, Kec. Mengwi, Kabupaten Badung, Bali 80351",09.00,21.30
LEE SHOP BALI HOME DRESS / DASTER,5.0,"Perum Griya Kawan Antasura, Jl. Antasura, Peguyangan, Kec. Denpasar Utara, Kota Denpasar, Bali 80238",09.00,17.00
Kampung Souvenir - Pusat Daster Bali,4.7,"Samping Indomaret Mertasari, Jl. Mertasari No.50B, Sidakarya, Denpasar Selatan, Kota Denpasar, Bali 80223",08.00,20.00
Paris Mode Bali,4.4,"Jl. Danau Buyan No.11 A, Sanur, Kota Denpasar",09.00,21.00
Dua Saudara Collection,4.6,"Jl. Pulau Serangan No.67B, Dauh Puri Klod, Kec. Denpasar Bar., Kota Denpasar, Bali 80114",09.00,21.00
Sindhu Bali Store,4.4,"Jl. Hayam Wuruk No.123, Sumerta Kelod, Kec. Denpasar Tim., Kota Denpasar, Bali 80239",09.00,22.00
DASTER PUTRI BALI 3,4.5,"Jl. Waturenggong No.131, Dauh Puri Klod, Denpasar Selatan, Kota Denpasar, Bali 80226",08.00,21.00
Bintang Bali Busana Adat,4.9,"Jl. Letda Made Putra No.38, Dauh Puri, Kec. Denpasar Bar., Kota Denpasar, Bali 80232",10.00,20.00
Pasar Seni Kuta,4.4,"Jl. Melasti No.86, Legian, Kec. Kuta, Kabupaten Badung, Bali 80361",06.00,23.00
Pasar Badung,4.5,"Jl. Sulawesi, Dauh Puri Kangin, pasar badung, Kota Denpasar, Bali 80221",16.00,20.30
Pasar Kuta 1,4.4,"Jl. Raya Kuta No.124, Kuta, Kec. Kuta, Kabupaten Badung, Bali 80361",05.30,20.00
Pasar Gunung Agung,4.3,"Jl. Gn. Agung No.4, Pemecutan Kaja, Kec. Denpasar Utara, Kota Denpasar, Bali 80111",02.00,23.00
Pasar Sindu,4.4,"Jl. Ps. Sindu No.5, Sanur, Denpasar Selatan, Kota Denpasar, Bali 80288",04.00,23.00
Pasar Seni Kumbasari,4.4,"Jl. Gajah Mada, Pemecutan, Kec. Denpasar Bar., Kota Denpasar, Bali 80111",09.00,17.00
Pasar Tradisional Kartika Udayana,4.6,"Kuta, Kec. Kuta, Kabupaten Badung, Bali 80361",04.00,20.00
Pasar Kreneng,4.4,"Dangin Puri Kangin, Kec. Denpasar Utara, Kota Denpasar, Bali 80236",04.00,15.00
Pasar Anyar Gelogor carik,4.6,"Jl. Glogor Carik No.27, Pemogan, Denpasar Selatan, Kota Denpasar, Bali 80221",02.00,23.00
Pasar Badung Kota Denpasar - Smart Heritage Market,4.5," Jalan Gajah Mada, Pemecutan, Dauh Puri Kangin, Denpasar City",02.00,23.00
Pasar Asoka,4.4,"Jl. Kamboja, Dangin Puri Kangin, Kec. Denpasar Utara, Kota Denpasar, Bali 80236",02.00,23.00
Pasar Tamansari Grudugan / Pasar Wates Sesetan,4.2,"Jl. Raya Sesetan No.333, Sesetan, Denpasar Selatan, Kota Denpasar, Bali 80223",02.00,23.00
"Pasar Pasah Pemecutan""",4.4,"Jl. Gn. Batur No.34, Pemecutan, Kec. Denpasar Bar., Kota Denpasar, Bali 80112",05.00,17.00
Pasar Tradisional Galang Ayu,4.5,"Jl. Pulau Galang No.9, Pemogan, Denpasar Selatan, Kota Denpasar, Bali 80113",08.00,22.00
Panjer Traditional Market,4.5,"Jl. Tukad Pakerisan No.6, Panjer, Denpasar Selatan, Kota Denpasar, Bali 80234",06.00,20.30
Pasar Desa Tegal Harum,4.4,"Jl. Gunung Rinjani No.99X, Tegal Harum, Kec. Denpasar Bar., Kota Denpasar, Bali 80112",06.00,16.30
Pasar Agung Peninjoan,4.4,"Jl. Cekomaria No.1, Peguyangan Kangin, Kec. Denpasar Utara, Kota Denpasar, Bali 80238",02.00,23.00
Pasar tradisional pasar sumuh,4.4,"Jl. Pulau Misol No.35, Dauh Puri Kauh, Kec. Denpasar Bar., Kota Denpasar, Bali 80113",05.00,21.00
PASAR TRADISIONAL ALAS KUSUMA,4.4,"Jl. Raya Uluwatu No.88, Jimbaran, Kec. Kuta Sel., Kabupaten Badung, Bali 80361",04.00,22.00
